{
  "$schema": "./education-content.schema.json",
  "schemaVersion": "1.0.0",
  "datasetId": "fiatlux-choice-esports-education-expansion",
  "title": "FIAT LUX 电竞教育运营与职业内容包",
  "status": "internal_draft",
  "audience": "中国境内成年电竞学习者、教练、赛事执行者与小型团队",
  "scope": "八篇覆盖教练责任、赛事运营、失败复盘、职业决策、数字安全、反馈方法、风险登记和试点复盘的内部草案；与首批四篇合并形成十二主题内容计划，不是公开招生、就业承诺或专业意见。",
  "lastUpdatedAt": "2026-07-20",
  "nextReviewAt": "2026-10-20",
  "maintenanceOwnerRole": "电竞教育负责人",
  "publicationBoundary": "所有文章当前均为内部草案。FIAT LUX CHOICE 不直接操作 WordPress；只有业务、教练、赛事运营、法务合规、财税、隐私、健康内容、信息安全和素材权利复核完成后，获授权人员才可在外部系统人工发布并回填真实证据。",
  "references": [
    {
      "id": "internal-esports-education-strategy",
      "kind": "internal",
      "title": "电竞教育在线业务策略",
      "authority": "FIAT LUX CHOICE 产品文档",
      "location": "docs/product/esports-education-strategy.md",
      "publishedAt": "2026-07-19",
      "lastVerifiedAt": "2026-07-19",
      "reviewStatus": "draft",
      "applicability": "用于约束成人、小班、人工交付、诚实营销和先复核后扩展的产品范围。",
      "usageBoundary": "内部业务草案，不证明耀光电竞已具备办学许可、标准化课程能力或任何对外可承诺结果。"
    },
    {
      "id": "internal-adult-esports-pilot-curriculum",
      "kind": "internal",
      "title": "成人电竞教育试点课程包",
      "authority": "FIAT LUX CHOICE 产品文档",
      "location": "docs/product/adult-esports-pilot-curriculum.md",
      "publishedAt": "2026-07-19",
      "lastVerifiedAt": "2026-07-19",
      "reviewStatus": "draft",
      "applicability": "用于定义四周竞技能力基础、六周团队赛训、评估量表、数据最小化和 AI 使用边界。",
      "usageBoundary": "未经业务、教练、法务合规、隐私和健康内容复核，不得直接据此招生、收费或评价学员权益。"
    },
    {
      "id": "cn-advertising-law-2021",
      "kind": "official",
      "title": "中华人民共和国广告法",
      "authority": "全国人民代表大会常务委员会",
      "location": "https://flk.npc.gov.cn/detail?bbbs=ff8081817ab231eb017abd6bd860052d",
      "publishedAt": "2021-04-29",
      "lastVerifiedAt": "2026-07-18",
      "reviewStatus": "pending",
      "applicability": "公开课程效果、师资、案例、合作方、证书或招生表述时用于真实性和禁止性内容复核。",
      "usageBoundary": "来源尚未完成人工适用性复核；不能把内部预测、示例、学员自评或课程草案写成确定的宣传事实。"
    },
    {
      "id": "cn-copyright-law-2020",
      "kind": "official",
      "title": "中华人民共和国著作权法",
      "authority": "全国人民代表大会常务委员会",
      "location": "https://flk.npc.gov.cn/detail?bbbs=ff808081752b7d430175e4766bab1557",
      "publishedAt": "2020-11-11",
      "lastVerifiedAt": "2026-07-18",
      "reviewStatus": "pending",
      "applicability": "课程、回放、游戏画面、图片、音乐、视频、讲师材料和学员作品的使用与许可复核。",
      "usageBoundary": "来源尚未完成人工适用性复核；教学或评论目的不当然等于可以复制、公开传播或商业使用第三方素材。"
    },
    {
      "id": "cn-personal-information-protection-law-2021",
      "kind": "official",
      "title": "中华人民共和国个人信息保护法",
      "authority": "全国人民代表大会常务委员会",
      "location": "https://flk.npc.gov.cn/detail?bbbs=ff8081817b6472a3017b656cc2040044",
      "publishedAt": "2021-08-20",
      "lastVerifiedAt": "2026-07-18",
      "reviewStatus": "pending",
      "applicability": "处理可识别学员、教练、队员的回放、语音、聊天、账号标识或反馈记录时用于必要性和处理边界复核。",
      "usageBoundary": "来源尚未完成人工适用性复核；不能以一份笼统同意替代具体场景中的目的、范围、保存期、访问控制和权利请求安排。"
    },
    {
      "id": "cn-health-literacy-2024",
      "kind": "official",
      "title": "中国公民健康素养——基本知识与技能（2024年版）",
      "authority": "国家卫生健康委办公厅",
      "location": "https://www.gov.cn/zhengce/zhengceku/202405/content_6954649.htm",
      "publishedAt": "2024-05-28",
      "lastVerifiedAt": "2026-07-19",
      "reviewStatus": "pending",
      "applicability": "用于一般健康素养、劳逸结合、充足睡眠、主动求助和正确获取健康信息的内容原则。",
      "usageBoundary": "国卫办宣传函〔2024〕191号不是医疗诊断、治疗、康复或电竞训练时长处方，不能支持固定休息分钟数或健康结果承诺。"
    },
    {
      "id": "cn-civil-code-2020",
      "kind": "official",
      "title": "中华人民共和国民法典",
      "authority": "全国人民代表大会",
      "location": "https://flk.npc.gov.cn/detail?bbbs=ff808081729d1efe01729d50b5c500bf",
      "publishedAt": "2020-05-28",
      "lastVerifiedAt": "2026-07-18",
      "reviewStatus": "pending",
      "applicability": "课程服务、用户协议、赛事委托、素材授权和侵权风险分析需要结合真实关系复核。",
      "usageBoundary": "来源尚未完成人工适用性复核；民法典不能单独替代消费者、劳动、知识产权、教育或行业特别规则判断。"
    },
    {
      "id": "cn-labor-contract-law-2012",
      "kind": "official",
      "title": "中华人民共和国劳动合同法",
      "authority": "全国人民代表大会常务委员会",
      "location": "https://flk.npc.gov.cn/detail?bbbs=2c909fdd678bf17901678bf74d7106b3",
      "publishedAt": "2012-12-28",
      "lastVerifiedAt": "2026-07-18",
      "reviewStatus": "pending",
      "applicability": "教练、领队或赛事人员形成劳动关系时，用于合同订立、履行、变更和解除终止流程复核。",
      "usageBoundary": "来源尚未完成人工适用性复核；岗位称谓或一份模板不能单独判定真实关系，处分和解除也不得由 AI 自动决定。"
    },
    {
      "id": "cn-cybersecurity-law-2025",
      "kind": "official",
      "title": "中华人民共和国网络安全法",
      "authority": "全国人民代表大会常务委员会",
      "location": "https://flk.npc.gov.cn/detail?bbbs=021e7d7684474107b8f3febbb1c4f8b5",
      "publishedAt": "2025-10-28",
      "lastVerifiedAt": "2026-07-18",
      "reviewStatus": "pending",
      "applicability": "运营网站、PWA、内网系统、在线课程或社群并处理数据时，需要结合网络运营者角色判断安全义务。",
      "usageBoundary": "来源尚未完成人工适用性复核；这是 2025 年修订、2026 年施行版本，不应继续引用旧版罚则，也不能把通用清单当作合规结论。"
    },
    {
      "id": "cn-consumer-protection-law-2013",
      "kind": "official",
      "title": "中华人民共和国消费者权益保护法",
      "authority": "全国人民代表大会常务委员会",
      "location": "https://flk.npc.gov.cn/detail?bbbs=2c909fdd678bf17901678bf7670606ef",
      "publishedAt": "2013-10-25",
      "lastVerifiedAt": "2026-07-18",
      "reviewStatus": "pending",
      "applicability": "自然人为生活消费购买课程、会员或服务时，需要复核信息披露、质量、退款、投诉和公平交易边界。",
      "usageBoundary": "来源尚未完成人工适用性复核；企业客户合同不当然排除最终自然人学员的消费者权益问题。"
    }
  ],
  "articles": [
    {
      "id": "player-to-coach-skill-and-duty-boundary",
      "slug": "player-to-coach-skill-and-duty-boundary",
      "title": "从玩家到教练：技能与责任边界",
      "summary": "用可观察的岗位能力、服务范围和责任边界替代“段位高就能教”的假设，帮助成人试点区分示范、反馈、管理、健康提示和正式人事决定。",
      "version": "0.1.0",
      "audience": "中国境内成年玩家、拟任教练、领队和小型电竞团队负责人",
      "applicability": [
        "适用于成人小班内部选拔教练、设计试讲和明确服务责任，不评价未成年人教学资格。",
        "适用于把竞技经验转成可验证教学行为；真实劳动、劳务或合作关系仍须按事实和合同另行复核。"
      ],
      "nonPromises": [
        "不承诺高段位、比赛经历或知名度自动等于教学能力。",
        "不承诺完成内部试讲即可获得岗位、劳动关系、签约或收入。",
        "不把课程中的岗位矩阵当作国家职业资格、教师资格或行业认证。",
        "不允许教练单独作出人事处分、医疗判断、退款拒绝或学员权益决定。"
      ],
      "safetyNotes": [
        "教练应只评价与课程目标有关的可观察行为，避免人格羞辱、歧视、威胁或诱导过量训练。",
        "涉及劳动关系、健康、骚扰、利益冲突或重大争议时应暂停普通反馈并交由有权负责人处理。"
      ],
      "learningObjectives": [
        "能区分竞技示范、教学诊断、反馈、班级管理和公司管理决定。",
        "能用证据设计一次可复核试讲，并写明超出教练权限时的升级路径。",
        "能识别岗位称谓、合同文本和真实管理方式可能不一致的风险。"
      ],
      "review": {
        "status": "pending",
        "ownerRole": "电竞教育负责人",
        "reviewerRoles": ["成人电竞教练", "人力行政负责人", "法务合规负责人"],
        "lastReviewedAt": null,
        "nextReviewAt": "2026-10-20",
        "note": "需要至少一名获授权教练完成内部试讲，并由人力与法务按真实合作模式复核岗位和权限边界。"
      },
      "rights": {
        "status": "pending_clearance",
        "basis": "岗位矩阵、案例和模板为内部原创草案；真实教练经历、赛事名称、照片和试讲录像均需单独取得使用依据。",
        "evidenceRefs": []
      },
      "publication": {
        "status": "not_published",
        "targetChannel": "fiatlux_gg_wordpress",
        "externalStateLabel": "WordPress 未发布",
        "evidenceUrl": null,
        "publishedAt": null,
        "manualBoundary": "本文只在系统中维护草案；完成教练、人力、法务、权利和业务复核后才可人工发布，不能把内部角色分配或任务完成写成外部师资背书。"
      },
      "aiDisclosure": {
        "assisted": true,
        "disclosure": "本草案由 AI 协助整理岗位维度与练习，尚未由真实教练、人力和法务确认；人工修改必须保留版本与理由。",
        "humanReviewRequired": true,
        "prohibitedUses": [
          "不得让模型根据段位、语音、外貌或少量回放自动决定录用、淘汰、处分或报酬。",
          "不得让模型虚构教练经历、资格、案例、学员评价或岗位需求。"
        ]
      },
      "sourceRefs": [
        "internal-esports-education-strategy",
        "internal-adult-esports-pilot-curriculum",
        "cn-labor-contract-law-2012",
        "cn-advertising-law-2021"
      ],
      "sections": [
        {
          "heading": "竞技经验只是输入，不是教学证明",
          "paragraphs": [
            "玩家经验可以帮助解释场景，但教学还要求把观察转成目标、练习、反馈和复核。只展示高水平操作，无法证明学员理解了原因，也无法说明不同基础的人如何安全调整。"
          ],
          "bullets": [
            "示范前说明目标和适用场景，示范后让学员复述决策依据。",
            "反馈引用时间点和动作，不使用“没天赋”“不适合”等人格结论。",
            "同一问题提供可缩小、暂停和求助的路径，而不是只增加训练量。"
          ]
        },
        {
          "heading": "把责任拆成可验证能力",
          "paragraphs": [
            "教练能力可以按课前准备、课堂观察、反馈设计、资料处理、边界升级和课后复核拆分。每项都应有证据和复核人，而不是用一个综合印象代替。"
          ],
          "bullets": [
            "课前：核对对象、版本、目标、资料必要性和停止条件。",
            "课中：观察行为、保持尊重、记录最少证据并控制节奏。",
            "课后：区分事实、推断和建议，说明未知项和下一次动作。",
            "升级：健康、骚扰、合同、退款、人事或安全事件交给相应责任人。"
          ]
        },
        {
          "heading": "岗位与权限必须跟随真实关系",
          "paragraphs": [
            "内部称谓不决定劳动、劳务或合作关系。排班、管理、报酬、工具、持续性和实际履行方式等事实需要由专业人员结合合同判断；课程材料不应预先替公司或个人作结论。"
          ],
          "example": {
            "label": "边界示例",
            "text": "教练可以记录某次试讲中反馈是否引用证据，但不能据此单独决定解除合作；公司负责人需核对真实关系、合同、制度、事实和程序。"
          }
        }
      ],
      "template": {
        "title": "教练岗位能力与权限矩阵",
        "instructions": "逐项写可观察行为、证据和升级对象；不填写证件号码、健康诊断或无关私人经历。",
        "fields": [
          {
            "label": "服务对象与范围",
            "guidance": "明确成年人对象、游戏项目、课程阶段和不提供的服务。",
            "example": "成人四周竞技基础；不处理医疗、人事或未成年人事项"
          },
          {
            "label": "可观察能力",
            "guidance": "列出备课、观察、反馈和复核中的具体行为。",
            "example": "反馈能够引用回放时间点并给出一个可验证动作"
          },
          {
            "label": "证据与复核人",
            "guidance": "说明试讲证据、保存期限和谁可以查看。",
            "example": "去标识试讲记录，由教育负责人和教练复核"
          },
          {
            "label": "禁止与升级事项",
            "guidance": "写明不得决定的事项和对应责任人。",
            "example": "不作人事处分或健康判断；交人力或健康负责人"
          }
        ],
        "completionRule": "只有范围、可观察能力、证据、复核人、禁止事项和升级路径都明确，且真实合作模式另经批准后，矩阵才可用于内部试讲。"
      },
      "practice": {
        "title": "把“高手教练”改写成可复核试讲",
        "scenario": "为一个成年小班设计 20 分钟内部试讲，不使用真实学员姓名或未授权赛事素材。",
        "steps": [
          "选择一个游戏无关的决策主题，写明学习目标和停止边界。",
          "设计一次示范、一次学员复述和一次基于证据的反馈。",
          "列出试讲不能证明的能力，以及遇到健康、人事或合同问题时的升级对象。"
        ],
        "deliverable": "一张岗位矩阵、一份 20 分钟试讲计划和一条明确的权限升级路径。",
        "selfCheck": [
          "能力是否都能由第三方观察，而不是依赖段位或名气？",